{
  "schemaVersion": 1,
  "requestID": "10000000-0000-4000-8000-000000000001",
  "producerInstanceID": "20000000-0000-4000-8000-000000000001",
  "createdAt": "2026-09-22T14:00:00Z",
  "expiresAt": "2026-09-22T14:02:00Z",
  "context": {
    "invocationID": "40000000-0000-4000-8000-000000000001",
    "entryPoint": "container",
    "container": {
      "refID": "30000000-0000-4000-8000-000000000001",
      "fileURL": "file:///private/tmp/RightMouse-TestFixtures/Destination/",
      "kindHint": "directory"
    },
    "selection": []
  },
  "action": {
    "type": "createFile",
    "templateID": "builtin.markdown",
    "destination": {
      "refID": "30000000-0000-4000-8000-000000000001",
      "fileURL": "file:///private/tmp/RightMouse-TestFixtures/Destination/",
      "kindHint": "directory"
    }
  }
}
